{
  "$schema": "https://json-schema.org/draft/2020-12/schema",
  "$id": "https://robin-des-stades.invalid/schemas/agent-report-v3.json",
  "title": "Robin Council agent report V3",
  "type": "object",
  "additionalProperties": false,
  "required": [
    "agent_id","mission_id","facts_verified","unknowns","assumptions",
    "main_objection","risks","minimum_decisive_test","recommended_action",
    "scale_condition","estimated_compute","estimated_external_cost",
    "estimated_human_time","maintenance_impact","confidence"
  ],
  "properties": {
    "agent_id": {"enum":["C0","C1","C2","C3","C4","DP1","DP2","DP3","DP4","DP5","DP6","RP1","RP2","RP3","RP4","RP5","RP6","RP7","RP8","RP9","RP10","UX1","UX2","UX3","UX4","UX5","UX6","A1","A2","A3"]},
    "mission_id": {"enum":["GOVERNANCE","PR26","CHRONOS_LOOP53","SCIENTIFIC_TRUTH_KERNEL","POINT_IN_TIME_LINEAGE","FIRST_FROZEN_RECEIPT_BACKED_SNAPSHOT","JALON4_WALL_CLOCK_DECAY_FIX_V1","BOUNDED_MULTI_LEAGUE_LIVE_CANARY_CAPABILITY_SUCCESSOR_V2","REAL_EXECUTION_BOOTSTRAP_CLOSURE_V1","FIRST_C0_VERTICAL_V1","ROBIN_REPRISE_COLLECTE_20261002","ROBIN_REPRISE_COLLECTE_20261002_CONTINUATION_V1","ROBIN_REPRISE_COLLECTE_20261002_CONTINUATION_V2","ROBIN_REAL_DATA_RESULT_20261003","ROBIN_AUTONOMOUS_LAB_20261004","ROBIN_AUTONOMOUS_LAB_SCHEDULE_RELIABILITY_20261004","ROBIN_AUTONOMOUS_LAB_ESTABLISHED_SCHEDULER_20261004","COVERAGE_P0","HYPERGRAPH","COCKPIT"]},
    "facts_verified": {"type":"array","items":{"$ref":"#/$defs/fact"}},
    "unknowns": {"type":"array","items":{"type":"string"}},
    "assumptions": {"type":"array","items":{"type":"string"}},
    "main_objection": {"type":"string","minLength":1},
    "risks": {"type":"array","items":{"$ref":"#/$defs/risk"}},
    "minimum_decisive_test": {"type":"string","minLength":1},
    "recommended_action": {"type":"string","minLength":1},
    "scale_condition": {"type":"string","minLength":1},
    "estimated_compute": {"type":"string","minLength":1},
    "estimated_external_cost": {"type":"string","minLength":1},
    "estimated_human_time": {"type":"string","minLength":1},
    "maintenance_impact": {"type":"string","minLength":1},
    "confidence": {"type":"number","minimum":0,"maximum":1}
  },
  "$defs": {
    "fact": {
      "type":"object",
      "additionalProperties":false,
      "required":["claim","evidence_refs","status"],
      "properties": {
        "claim":{"type":"string","minLength":1},
        "evidence_refs":{"type":"array","minItems":1,"items":{"type":"string","minLength":1}},
        "status":{"enum":["VERIFIED","PARTIAL","BLOCKED"]}
      }
    },
    "risk": {
      "type":"object",
      "additionalProperties":false,
      "required":["risk","severity","evidence_refs"],
      "properties": {
        "risk":{"type":"string","minLength":1},
        "severity":{"enum":["CRITICAL","HIGH","MEDIUM","LOW"]},
        "evidence_refs":{"type":"array","minItems":1,"items":{"type":"string","minLength":1}}
      }
    }
  }
}
